{
  "id" : "01CFEFF8DA586E548327E539276C42F3",
  "name" : "01 Cross Country Stadio Track Dobbiaco/Toblach",
  "description" : "Demanding round-trip tours starting at the cross-country stadium in Dobbiaco, often used as training tracks by various national cross-country teams from all over the world.This trail will be floodlit on Monday and Thursday from 5:00 pm to 8:00 pm from. Use is subject to a fee.",
  "types" : [ "loipen", "klassisch und skating" ],
  "hasGPSTrack" : true,
  "region" : "D2633A1FC24E11D18F1B006097B8970B"
}